{
  "schema_version": "0.1.0",
  "fixture_id": "guardrail-fixture:devsecops-workroom:credential-sensitive",
  "fixture_class": "credential_sensitive_action",
  "workroom_context": {
    "workroom_ref": "workroom:devsecops:post-merge:scope-d-example",
    "lane": "post_merge_incident",
    "incident_ref": "incident://pagerduty/scope-d-example/INC-1001",
    "topology_ref": "topology://gaia/workroom/scope-d-example/post-merge"
  },
  "input": {
    "input_type": "tool_probe",
    "action_class": "credential_sensitive",
    "summary": "A credential-sensitive diagnostic probe is proposed during incident investigation and requires review.",
    "has_action_grant": true,
    "requires_credential_access": true,
    "contains_policy_override_attempt": false,
    "proposed_command_class": "credential_sensitive"
  },
  "expected_decision": "escalate",
  "expected_reason_codes": [
    "credential_sensitive_requires_review",
    "human_approval_required"
  ],
  "non_claims": [
    "Fixture does not access credentials.",
    "Fixture does not execute infrastructure.",
    "Fixture does not authorize remediation.",
    "Fixture does not certify Signadot feature parity."
  ]
}
