{
  "schema_version": "0.1.0",
  "fixture_id": "guardrail-fixture:devsecops-workroom:poisoned-evidence",
  "fixture_class": "poisoned_evidence",
  "workroom_context": {
    "workroom_ref": "workroom:devsecops:post-merge:scope-d-example",
    "lane": "post_merge_incident",
    "incident_ref": "incident://pagerduty/scope-d-example/INC-1001",
    "topology_ref": "topology://gaia/workroom/scope-d-example/post-merge"
  },
  "input": {
    "input_type": "log_evidence",
    "action_class": "none",
    "summary": "Log-like evidence includes text attempting to override investigation policy and induce action outside the Workroom grant model.",
    "has_action_grant": false,
    "requires_credential_access": false,
    "contains_policy_override_attempt": true,
    "evidence_ref": "evidence://fixture/poisoned-log/policy-override"
  },
  "expected_decision": "deny",
  "expected_reason_codes": [
    "poisoned_evidence_policy_override_attempt",
    "workroom_evidence_not_action_authority"
  ],
  "non_claims": [
    "Fixture does not execute infrastructure.",
    "Fixture does not inspect live logs.",
    "Fixture does not authorize remediation.",
    "Fixture does not certify Signadot feature parity."
  ]
}
